{
  "specVersion": 0,
  "title": "Projectile Fixture",
  "hook": "Two players, a thrown ball and a water stream, to check the projectile mechanic.",
  "prompt": "mechanic fixture: projectile",
  "players": { "min": 2, "max": 2, "bots": false, "teams": 0, "mode": "versus" },
  "round": { "seconds": 120, "winBy": "most hits", "replay": true },
  "camera": "third",
  "controls": { "primary": "throw the ball", "secondary": "hold to spray" },
  "world": {
    "template": "backyard",
    "size": "small",
    "props": [ { "name": "ball", "describe": "a soft red rubber dodgeball", "count": 1, "from": "library", "role": "thrown by players" } ],
    "notes": ""
  },
  "mechanics": [
    { "id": "projectile", "as": "ball and stream", "params": { "kind": "discrete", "prop": "ball", "speed": 18, "knockback": 6, "cooldown": 0.3, "splashRadius": 1.5, "streamTank": 0 } },
    { "id": "health", "as": "five hit points", "params": { "hp": 5, "getUpSeconds": 1.2, "respawnSeconds": 2 } }
  ],
  "rules": { "summary": "Hit the other player.", "scoring": "+1 per hit", "params": {} },
  "characters": [ { "role": "player", "describe": "a round jelly-bean kid", "body": { "from": "bean" } } ],
  "look": { "preset": "jelly-pastel", "time": "day" },
  "sounds": [ { "id": "throw", "describe": "whoosh of a thrown ball" }, { "id": "bonk", "describe": "rubbery bonk" } ],
  "content": { "rating": "E" },
  "notInV1": [],
  "accept": ["a hit shows on both screens"]
}
