{
  "specVersion": 0,
  "title": "Pickup Fixture",
  "hook": "Two players to check the pickup mechanic.",
  "prompt": "mechanic fixture: pickup",
  "players": {
    "min": 2,
    "max": 2,
    "bots": false,
    "teams": 0,
    "mode": "versus"
  },
  "round": {
    "seconds": 300,
    "winBy": "most hits",
    "replay": true
  },
  "camera": "third",
  "controls": {
    "primary": "primary",
    "interact": "use"
  },
  "world": {
    "template": "backyard",
    "size": "small",
    "props": [
      {
        "name": "ball",
        "describe": "a soft red rubber dodgeball",
        "count": 2,
        "from": "library",
        "role": "carry thrown by players"
      }
    ],
    "notes": ""
  },
  "mechanics": [
    {
      "id": "pickup",
      "as": "coins to collect",
      "params": {
        "count": 2,
        "zone": "centre",
        "effect": "score",
        "value": 1,
        "respawnSeconds": 2,
        "prop": "ball"
      }
    }
  ],
  "rules": {
    "summary": "Hit the other player.",
    "scoring": "+1 per hit",
    "params": {}
  },
  "characters": [
    {
      "role": "player",
      "describe": "a round jelly-bean kid",
      "body": {
        "from": "bean"
      }
    }
  ],
  "look": {
    "preset": "jelly-pastel",
    "time": "day"
  },
  "sounds": [],
  "content": {
    "rating": "E"
  },
  "notInV1": [],
  "accept": [
    "a hit shows on both screens"
  ]
}