{
  "specVersion": 0,
  "title": "Race Fixture",
  "hook": "Two players to check the race mechanic.",
  "prompt": "mechanic fixture: race",
  "players": {
    "min": 2,
    "max": 2,
    "bots": false,
    "teams": 0,
    "mode": "versus"
  },
  "round": {
    "seconds": 300,
    "winBy": "most hits",
    "replay": true
  },
  "camera": "third",
  "controls": {
    "primary": "primary",
    "interact": "use"
  },
  "world": {
    "template": "backyard",
    "size": "small",
    "props": [],
    "notes": ""
  },
  "mechanics": [
    {
      "id": "race",
      "as": "a lap around the yard",
      "params": {
        "ringCount": 3,
        "laps": 1,
        "radius": 2.5,
        "placePoints": [
          3,
          2,
          1
        ]
      }
    }
  ],
  "rules": {
    "summary": "Hit the other player.",
    "scoring": "+1 per hit",
    "params": {}
  },
  "characters": [
    {
      "role": "player",
      "describe": "a round jelly-bean kid",
      "body": {
        "from": "bean"
      }
    }
  ],
  "look": {
    "preset": "jelly-pastel",
    "time": "day"
  },
  "sounds": [],
  "content": {
    "rating": "E"
  },
  "notInV1": [],
  "accept": [
    "a hit shows on both screens"
  ]
}
