{
  "specVersion": 0,
  "title": "Melee Fixture",
  "hook": "Two players to check the melee mechanic.",
  "prompt": "mechanic fixture: melee",
  "players": { "min": 2, "max": 2, "bots": false, "teams": 0, "mode": "versus" },
  "round": { "seconds": 300, "winBy": "most hits", "replay": true },
  "camera": "third",
  "controls": { "primary": "swing", "secondary": "heavy strike", "jump": "dodge" },
  "world": { "template": "arena", "size": "small", "props": [], "notes": "" },
  "mechanics": [
    { "id": "melee", "as": "a sword", "params": {} },
    { "id": "health", "as": "hearts", "params": { "hp": 20, "respawnSeconds": 3 } },
    { "id": "waves", "as": "one slow warrior", "params": { "startCount": 1, "growth": 0, "maxWaves": 1, "firstDelay": 0.5, "types": [{ "id": "warrior", "behaviour": "chaser", "hp": 50, "speed": 0.4, "damage": 0, "knock": 0 }] } }
  ],
  "rules": { "summary": "Swing at the other player.", "scoring": "+1 per hit", "params": {} },
  "characters": [ { "role": "player", "describe": "a round jelly-bean kid", "body": { "from": "bean" } } ],
  "look": { "preset": "jelly-pastel", "time": "day" },
  "sounds": [],
  "content": { "rating": "E" },
  "notInV1": [],
  "accept": [ "a swing shows on both screens and hits once" ]
}
