{
  "specVersion": 0,
  "title": "Station Fixture",
  "hook": "Two players to check the station mechanic.",
  "prompt": "mechanic fixture: station",
  "players": {
    "min": 2,
    "max": 2,
    "bots": false,
    "teams": 0,
    "mode": "versus"
  },
  "round": {
    "seconds": 300,
    "winBy": "most hits",
    "replay": true
  },
  "camera": "third",
  "controls": {
    "primary": "primary",
    "interact": "use"
  },
  "world": {
    "template": "backyard",
    "size": "small",
    "props": [],
    "notes": ""
  },
  "mechanics": [
    {
      "id": "station",
      "as": "a desk with a job quota",
      "params": {
        "stations": [
          {
            "at": [
              0,
              0,
              3
            ],
            "title": "Job desk"
          }
        ],
        "mode": "hold",
        "taskSeconds": 1.5,
        "cooldown": 2,
        "quota": 2,
        "action": "interact",
        "showPrompt": false
      }
    }
  ],
  "rules": {
    "summary": "Hit the other player.",
    "scoring": "+1 per hit",
    "params": {}
  },
  "characters": [
    {
      "role": "player",
      "describe": "a round jelly-bean kid",
      "body": {
        "from": "bean"
      }
    }
  ],
  "look": {
    "preset": "jelly-pastel",
    "time": "day"
  },
  "sounds": [],
  "content": {
    "rating": "E"
  },
  "notInV1": [],
  "accept": [
    "a hit shows on both screens"
  ]
}
